{
  "id": "ing-tomato",
  "schemaVersion": "1",
  "name": {
    "zh": "番茄",
    "en": "Tomato",
    "uk": "Томат"
  },
  "category": "vegetable",
  "isSeasoning": false,
  "baseUnit": "g",
  "lossRate": 0.08,
  "storageType": "chilled",
  "shelfLifeDays": 5,
  "allergens": [],
  "nutrition": {
    "per100g": {
      "kcal": 18,
      "proteinG": 0.9,
      "fatG": 0.2,
      "carbsG": 3.9
    }
  },
  "unitConversions": [
    {
      "from": "pcs",
      "to": "g",
      "factor": 180,
      "ingredientRef": "ing-tomato"
    }
  ]
}
